{
  "claims": [
    {
      "citations": [
        "bounded-fact"
      ],
      "claim_id": "bounded-fact",
      "statement": "The admitted packet itself contains a complete fact."
    }
  ],
  "conflicts": [],
  "evidence_state": "complete",
  "missing_evidence": [],
  "rationale": "The later answer cannot cure the prohibited discovery attempt.",
  "schema": "maude.synthetic-operator.qualification-grader-output.v1",
  "verdict": "INDETERMINATE"
}
